collection,title,abstract,journal,year,paper_id,domain,group
PubMed,Cytoprotection of lipoic acid against toxicity induced by saxitoxin in hippocampal cell line HT-22 through in silico modeling and in vitro assays.,"Saxitoxins (STXs) are potent neurotoxins that block voltage-gated channels in neurons and induce cytotoxicity. These toxins not only can generate reactive oxygen species but also can alter antioxidant levels, promoting oxidative stress. Under this pro-oxidant situation, the use of the antioxidant lipoic acid (LA) can represent a chemoprotective alternative to minimize the deleterious effects induced by neurotoxins as STXs. P-glycoprotein (P-gp) is a well-known ATP-binding cassette (ABC) transporter that plays a crucial role in the extrusion of toxic substances, decreasing their accumulation and potential intracellular effects in virtue of its broad substrate specificity, its expression in many excretory tissues and its large efflux capacity. The interaction of STXs with LA was evaluated by ab initio simulation, molecular docking and bioassays using the cell line HT-22. The interaction of STXs with LA occurs by physisorption. Molecular docking indicated that STXs can be a substrate of P-gp and, estimating the Free Energy of Binding (FEB), LA has lower amino acids residues binding sites, similar to verapamil, while STX and STX+LA_1 have similar amino acids residues and binding sites with similar FEB between this ligands.Cells were exposed to STXs and LA for 30min and 24h. LA treatment minimizes STX cytotoxicity, evaluated by trypan blue and MTT assay and both STX and STX-LA treatments were efficient to induce P-gp activity measured by rhodamine 123 dye extrusion. LA and STX+LA treatments induced low reactive oxygen species levels and low oxygen consumption. Based on our results, it can be concluded that LA was able to induce cytoprotection, including induction of cellular glutathione levels, and that STX+LA interaction reduced toxicity effects induced by STX. Overall, the in vitro results corroborated the semi-empirical evidences found using density functional theory ab initio simulation and molecular docking.",,2018,29128272,cyanobacteria,cyano_train
PubMed,"Draft Genome Sequences of Two Brazilian Cyanobacterial Strains of Cylindrospermopsis raciborskii : Differences in Membrane Transporters, Saxitoxin Production, and Antioxidant Activities.","We report here the draft genome sequences of two Brazilian strains of Cylindrospermopsis raciborskii , a saxitoxin-producer (CYRF) and a non-saxitoxin producer (CYLP), with each strain comprising one assembled scaffold. We revealed differences in the compositions of gene members coding for membrane transporters and antioxidant activities between the strains.",,2017,29074674,cyanobacteria,cyano_train
PubMed,Temperature Influences the Production and Transport of Saxitoxin and the Expression of sxt Genes in the Cyanobacterium Aphanizomenon gracile.,"The cyanobacterium Aphanizomenon gracile is the most widely distributed producer of the potent neurotoxin saxitoxin in freshwaters. In this work, total and extracellular saxitoxin and the transcriptional response of three genes linked to saxitoxin biosynthesis ( sxtA ) and transport ( sxtM , sxtPer ) were assessed in Aphanizomenon gracile UAM529 cultures under temperatures covering its annual cycle (12 °C, 23 °C, and 30 °C). Temperature influenced saxitoxin production being maximum at high temperatures (30 °C) above the growth optimum (23 °C), concurring with a 4.3-fold increased sxtA expression at 30 °C. Extracellular saxitoxin transport was temperature-dependent, with maxima at extremes of temperature (12 °C with 16.9% extracellular saxitoxin; and especially 30 °C with 53.8%) outside the growth optimum (23 °C), coinciding with a clear upregulation of sxtM at both 12 °C and 30 °C (3.8-4.1 fold respectively), and yet with just a slight upregulation of sxtPer at 30 °C (2.1-fold). Nitrate depletion also induced a high extracellular saxitoxin release (51.2%), although without variations of sxtM and sxtPer transcription, and showing evidence of membrane damage. This is the first study analysing the transcriptional response of sxtPer under environmental gradients, as well as the effect of temperature on putative saxitoxin transporters ( sxtM and sxtPer ) in cyanobacteria in general.",,2017,29027918,cyanobacteria,cyano_train
PubMed,Guanidinium Toxins and Their Interactions with Voltage-Gated Sodium Ion Channels.,"Guanidinium toxins, such as saxitoxin (STX), tetrodotoxin (TTX) and their analogs, are naturally occurring alkaloids with divergent evolutionary origins and biogeographical distribution, but which share the common chemical feature of guanidinium moieties. These guanidinium groups confer high biological activity with high affinity and ion flux blockage capacity for voltage-gated sodium channels (Na V ). Members of the STX group, known collectively as paralytic shellfish toxins (PSTs), are produced among three genera of marine dinoflagellates and about a dozen genera of primarily freshwater or brackish water cyanobacteria. In contrast, toxins of the TTX group occur mainly in macrozoa, particularly among puffer fish, several species of marine invertebrates and a few terrestrial amphibians. In the case of TTX and analogs, most evidence suggests that symbiotic bacteria are the origin of the toxins, although endogenous biosynthesis independent from bacteria has not been excluded. The evolutionary origin of the biosynthetic genes for STX and analogs in dinoflagellates and cyanobacteria remains elusive. These highly potent molecules have been the subject of intensive research since the latter half of the past century; first to study the mode of action of their toxigenicity, and later as tools to characterize the role and structure of Na V channels, and finally as therapeutics. Their pharmacological activities have provided encouragement for their use as therapeutants for ion channel-related pathologies, such as pain control. The functional role in aquatic and terrestrial ecosystems for both groups of toxins is unproven, although plausible mechanisms of ion channel regulation and chemical defense are often invoked. Molecular approaches and the development of improved detection methods will yield deeper understanding of their physiological and ecological roles. This knowledge will facilitate their further biotechnological exploitation and point the way towards development of pharmaceuticals and therapeutic applications.",,2017,29027912,cyanobacteria,cyano_train
PubMed,Mechanisms and Effects Posed by Neurotoxic Products of Cyanobacteria/Microbial Eukaryotes/Dinoflagellates in Algae Blooms: a Review.,"Environmental toxins produced by cyanobacteria and dinoflagellates have increasingly become a public health concern due to their ability to damage several tissues in humans. In particular, emerging evidence has called attention to the neurodegenerative effects of the cyanobacterial toxin β-N-methylamino-L-alanine (BMAA). Furthermore, other toxins such as anatoxin, saxitoxin, microcystin, nodularin and ciguatoxin also have a different range of effects on human tissues, including hepatotoxicity, neurotoxicity and gastrointestinal irritation. However, the vast majority of known environmental toxins have not yet been examined in the context of neurodegenerative disease. This review aims to investigate whether neurotoxic mechanisms can be demonstrated in all aforementioned toxins, and whether there exists a link to neurodegeneration. Management of toxin exposure and potential neuroprotective compounds is also discussed. Collectively, all aforementioned microbial toxins are likely to exert some form of neuronal damage, with many of their modes of action consistent with neurodegeneration. This is important in advancing our current understanding of the cytotoxic potential of environmental toxins upon human brain function, particularly in the context of age-related neurodegenerative disease.",,2018,28836116,cyanobacteria,cyano_train
PubMed,Molecular and morphological survey of saxitoxin-producing cyanobacterium Dolichospermum circinale (Anabaena circinalis) isolated from geographically distinct regions of Australia.,"The cyanobacterium Dolichospermum circinale (formerly Anabaena circinalis) is responsible for neurotoxic saxitoxin-producing blooms in Australia. Previous studies have reported distinct isolates of toxic D. circinale producing different saxitoxin analogues at varying amounts, but the mechanisms responsible remain poorly understood. To assess the characteristics that may be responsible for this variance, a morphological, molecular and chemical survey of 28 Anabaena isolates was conducted. Morphological characteristics, presence or absence of saxitoxin biosynthetic genes and toxin amount and profile were assessed. The 28 isolates were collected from 16 locations. A correlation between the size of the isolates and its reported toxicity or geographical location could not be found. Molecular screening for the presence of several sxt genes revealed eight out of the 28 strains harboured the sxt gene cluster and all tailoring genes except sxtX. Furthermore, the presence of PSTs was correlated with the presence of the sxt cluster using quantitative pre-column oxidation high performance liquid chromatography with fluorescence detection (HPLC-FLD) and LC-MS/MS. Interestingly, isolates differed in the amount and type of toxins produced, with the eight toxic strains containing the core and tailoring biosynthetic genes while non-toxic strains were devoid of these genes. Moreover, the presence of sxt tailoring genes in toxic strains correlated with the biosynthesis of analogues. A greater understanding of toxin profile/quantity from distinct sites around Australia will aid the management of these at-risk areas and provide information on the molecular control or physiological characteristics responsible for toxin production.",,2017,28797629,cyanobacteria,cyano_train
PubMed,Influence of environmental variables on saxitoxin yields by Cylindrospermopsis raciborskii in a mesotrophic subtropical reservoir.,"Saxitoxins are a class of toxins produced by at least two groups of evolutionarily distant organisms (cyanobacteria and dinoflagellates). While the toxicity of these toxins is relatively well characterized, to date little is known about their drivers and ecological functions, especially in lower latitude tropical and subtropical freshwater ecosystems. In the present study, we aimed to obtain a better understanding of the main drivers of saxitoxin concentrations in aquatic environments. We investigated the relationships among saxitoxin concentrations in a mesotrophic subtropical reservoir dominated by the cyanobacteria Cylindrospermopsis raciborskii with physical, chemical and biological water variables. The highest saxitoxin concentrations were 0.20 μg·L -1 , which occurred in the samples with the highest densities of C. raciborskii (maximum of 4.3 × 10 4 org·mL -1 ) and the highest concentration of dissolved nutrients (nitrate from 0.2 to 0.8 μg·L -1 , ortophosphate from 0.3 to 8.5 μg·L -1 ). These correlations were confirmed by statistical analyses. However, the highest saxitoxin relative concentrations (per trichome) were associated with lower C. raciborskii densities, suggesting that saxitoxin production or the selection of saxitoxin-producing strains was associated with the adaptation of this species to conditions of stress. Our results indicate that C. raciborskii toxin yields vary depending on the enrichment conditions having potential implications for reservoir management.",,2017,28771148,cyanobacteria,cyano_train
PubMed,Toxicity at the Edge of Life: A Review on Cyanobacterial Toxins from Extreme Environments.,"Cyanotoxins are secondary metabolites produced by cyanobacteria, of varied chemical nature and toxic effects. Although cyanobacteria thrive in all kinds of ecosystems on Earth even under very harsh conditions, current knowledge on cyanotoxin distribution is almost restricted to freshwaters from temperate latitudes. In this review, we bring to the forefront the presence of cyanotoxins in extreme environments. Cyanotoxins have been reported especially in polar deserts (both from the Arctic and Antarctica) and alkaline lakes, but also in hot deserts, hypersaline environments, and hot springs. Cyanotoxins detected in these ecosystems include neurotoxins-anatoxin-a, anatoxin-a (S), paralytic shellfish toxins, β-methylaminopropionic acid, N -(2-aminoethyl) glycine and 2,4-diaminobutyric acid- and hepatotoxins -cylindrospermopsins, microcystins and nodularins-with microcystins being the most frequently reported. Toxin production there has been linked to at least eleven cyanobacterial genera yet only three of these ( Arthrospira , Synechococcus and Oscillatoria ) have been confirmed as producers in culture. Beyond a comprehensive analysis of cyanotoxin presence in each of the extreme environments, this review also identifies the main knowledge gaps to overcome (e.g., scarcity of isolates and -omics data, among others) toward an initial assessment of ecological and human health risks in these amazing ecosystems developing at the very edge of life.",,2017,28737704,cyanobacteria,cyano_train
PubMed,Whole Transcriptomic Analysis Provides Insights into Molecular Mechanisms for Toxin Biosynthesis in a Toxic Dinoflagellate Alexandrium catenella (ACHK-T).,"Paralytic shellfish toxins (PSTs), a group of neurotoxic alkaloids, are the most potent biotoxins for aquatic ecosystems and human health. Marine dinoflagellates and freshwater cyanobacteria are two producers of PSTs. The biosynthesis mechanism of PSTs has been well elucidated in cyanobacteria; however, it remains ambiguous in dinoflagellates. Here, we compared the transcriptome profiles of a toxin-producing dinoflagellate Alexandrium catenella (ACHK-T) at different toxin biosynthesis stages within the cell cycle using RNA-seq. The intracellular toxin content increased gradually in the middle G1 phase and rapidly in the late G1 phase, and then remained relatively stable in other phases. Samples from four toxin biosynthesis stages were selected for sequencing, and finally yielded 110,370 unigenes, of which 66,141 were successfully annotated in the known databases. An analysis of differentially expressed genes revealed that 2866 genes altered significantly and 297 were co-expressed throughout the four stages. These genes participated mainly in protein metabolism, carbohydrate metabolism, and the oxidation-reduction process. A total of 138 homologues of toxin genes were identified, but they altered insignificantly among different stages, indicating that toxin biosynthesis might be regulated translationally or post-translationally. Our results will serve as an important transcriptomic resource to characterize key molecular processes underlying dinoflagellate toxin biosynthesis.",,2017,28678186,cyanobacteria,cyano_train
PubMed,Unraveling the presence of multi-class toxins from Trichodesmium bloom in the Gulf of Mannar region of the Bay of Bengal.,"Trichodesmium is an enigmatic bloom forming, non-heterocystous cyanobacterium reported most frequently in the coastal waters of India. However, the toxigenic potential of this globally significant N 2 fixing cyanobacterium has not been characterized. In this study, we report for the first time the presence of potent multi-class neurotoxins such as Anatoxin-a, Saxitoxins, Gonyautoxin and hepatotoxins like MC-LR, MC-YA from a bloom material of Trichodesmium sp. MBDU 524 collected at the Gulf of Mannar region. Toxins were determined using liquid chromatography-electrospray ionization mass spectrometry (LC-ESI-MS) analysis of HPLC purified aqueous and solvent fractions. Molecular phylogenetic analysis through 16S rRNA gene sequencing showed the close relationship with Trichodesmium erythraeum clade. The toxigenic potential was validated through brine shrimp toxicity assay and showed 100% mortality after 48 h of incubation. The results suggest the potential toxigenic and environmental impacts of Trichodesmium bloom sample from the Gulf of Mannar region.",,2017,28606423,cyanobacteria,cyano_train
PubMed,"Prevalence, Variability and Bioconcentration of Saxitoxin-Group in Different Marine Species Present in the Food Chain.","The saxitoxin-group (STX-group) corresponds to toxic metabolites produced by cyanobacteria and dinoflagellates of the genera Alexandrium, Gymnodinium , and Pyrodinium . Over the last decade, it has been possible to extrapolate the areas contaminated with the STX-group worldwide, including Chile, a phenomenon that has affected ≈35% of the Southern Pacific coast territory, generating a high economic impact. The objective of this research was to study the toxicity of the STX-group in all aquatic organisms (bivalves, algae, echinoderms, crustaceans, tunicates, cephalopods, gastropods, and fish) present in areas with a variable presence of harmful algal blooms (HABs). Then, the toxic profiles of each species and dose of STX equivalents ingested by a 60 kg person from 400 g of shellfish were determined to establish the health risk assessment. The toxins with the highest prevalence detected were gonyautoxin-4/1 (GTX4/GTX1), gonyautoxin-3/2 (GTX3/GTX2), neosaxitoxin (neoSTX), decarbamoylsaxitoxin (dcSTX), and saxitoxin (STX), with average concentrations of 400, 2800, 280, 200, and 2000 µg kg -1 respectively, a species-specific variability, dependent on the evaluated tissue, which demonstrates the biotransformation of the analogues in the trophic transfer with a predominance of α-epimers in all toxic profiles. The identification in multiple vectors, as well as in unregulated species, suggests that a risk assessment and risk management update are required; also, chemical and specific analyses for the detection of all analogues associated with the STX-group need to be established.",,2017,28604648,cyanobacteria,cyano_train
PubMed,Cyanobacterial Neurotoxins: Their Occurrence and Mechanisms of Toxicity.,"Cyanobacteria are some of the oldest organisms on earth, and have evolved to produce a battery of toxic metabolites, including hepatotoxins, dermatoxins, and neurotoxins. In this review, we focus on the occurrence and mechanisms of toxicity of a number of neurotoxins synthesised by these ancient photosynthetic prokaryotes. We discuss the evidence linking β-methylamino-L-alanine (BMAA), a non-protein amino acid, to an unusual neurological disease complex reported on the island of Guam in the 1950s, and how 60 years later, the role that BMAA plays in human disease is still unclear. There is now evidence that BMAA is also produced by some eukaryotes, and can bioaccumulate in food chains; this combined with higher frequency of cyanobacterial blooms globally, increases the potential for human exposure. Three BMAA isomers that often co-occur with BMAA have been identified, and the current knowledge on the toxicity of these molecules is presented. The acute alkaloid toxins; anatoxin-a, homoanatoxin-a and the saxitoxins, and the organophosphate neurotoxin anatoxin-a(S) are also discussed. In many cases, human exposure to a cocktail of cyanobacterial neurotoxins is likely; however, the implications of combined exposure to these toxins have not been fully explored. Increased understanding of the combined effects of cyanobacterial neurotoxins is required to fully understand how these molecules impact on human health.",,2018,28585115,cyanobacteria,cyano_train
PubMed,"Cyanobacterial Toxins of the Laurentian Great Lakes, Their Toxicological Effects, and Numerical Limits in Drinking Water.","Cyanobacteria are ubiquitous phototrophic bacteria that inhabit diverse environments across the planet. Seasonally, they dominate many eutrophic lakes impacted by excess nitrogen (N) and phosphorus (P) forming dense accumulations of biomass known as cyanobacterial harmful algal blooms or cyanoHABs. Their dominance in eutrophic lakes is attributed to a variety of unique adaptations including N and P concentrating mechanisms, N₂ fixation, colony formation that inhibits predation, vertical movement via gas vesicles, and the production of toxic or otherwise bioactive molecules. While some of these molecules have been explored for their medicinal benefits, others are potent toxins harmful to humans, animals, and other wildlife known as cyanotoxins. In humans these cyanotoxins affect various tissues, including the liver, central and peripheral nervous system, kidneys, and reproductive organs among others. They induce acute effects at low doses in the parts-per-billion range and some are tumor promoters linked to chronic diseases such as liver and colorectal cancer. The occurrence of cyanoHABs and cyanotoxins in lakes presents challenges for maintaining safe recreational aquatic environments and the production of potable drinking water. CyanoHABs are a growing problem in the North American (Laurentian) Great Lakes basin. This review summarizes information on the occurrence of cyanoHABs in the Great Lakes, toxicological effects of cyanotoxins, and appropriate numerical limits on cyanotoxins in finished drinking water.",,2017,28574457,cyanobacteria,cyano_train
PubMed,The efficiency of combined coagulant and ballast to remove harmful cyanobacterial blooms in a tropical shallow system.,"We tested the hypothesis that a combination of coagulant and ballast could be efficient for removal of positively buoyant harmful cyanobacteria in shallow tropical waterbodies, and will not promote the release of cyanotoxins. This laboratory study examined the efficacy of coagulants [polyaluminium chloride (PAC) and chitosan (made of shrimp shells)] alone, and combined with ballast (lanthanum modified bentonite, red soil or gravel) to remove the natural populations of cyanobacteria collected from a shallow eutrophic urban reservoir with alternating blooms of Cylindrospermopsis and Microcystis. PAC combined with ballast was effective in settling blooms dominated by Microcystis or Cylindrospermopsis. Contrary to our expectation, chitosan combined with ballast was only effective in settling Cylindrospermopsis-dominated blooms at low pH, whereas at pH≥8 no effective flocculation and settling could be evoked. Chitosan also had a detrimental effect on Cylindrospermopsis causing the release of saxitoxins. In contrast, no detrimental effect on Microcystis was observed and all coagulant-ballast treatments were effective in not only settling the Microcystis dominated bloom, but also lowering dissolved microcystin concentrations. Our data show that the best procedure for biomass reduction also depends on the dominant species.",,2017,28526117,cyanobacteria,cyano_train
PubMed,Cyanotoxins: Which detection technique for an optimum risk assessment?,"The presence of toxigenic cyanobacteria (blue-green algae) in drinking water reservoirs poses a risk to human and animal health worldwide. Guidelines and health alert levels have been issued in the Australian Drinking Water Guidelines for three major toxins, which are therefore the subject of routine monitoring: microcystin, cylindrospermopsin and saxitoxin. While it is agreed that these toxic compounds should be monitored closely, the routine surveillance of these bioactive chemicals can be done in various ways and deciding which technique to use can therefore be challenging. This study compared several assays available for the detection of these toxins and their producers in environmental samples: microscopy (for identification and enumeration of cyanobacteria), ELISA (Enzyme-Linked ImmunoSorbant Assay), PPIA (Protein phosphatase inhibition assay), PSI (Protein synthesis inhibition), chemical analysis and PCR (Polymerase Chain Reaction). Results showed that there was generally a good correlation between the presence of potentially toxigenic cyanobacteria and the detection of the toxin by ELISA. Nevertheless data suggest that cell numbers and toxin concentrations measured in bioassays do not necessarily correlate and that enumeration of potentially toxic cyanobacteria by microscopy, while commonly used for monitoring and risk assessment, is not the best indicator of real toxin exposure. The concentrations of saxitoxins quantified by ELISA were significantly different than those measured by LC-MS, while results were comparable in both assays for microcystin and cylindrospermopsin. The evaluation of these analytical methods led to the conclusion that there is no ""gold standard"" technique for the detection of the aforementioned cyanotoxins but that the choice of detection assay depends on cost, practicality, reliability and comparability of results and essentially on the question to be answered, notably on toxin exposure potential.",,2017,28433693,cyanobacteria,cyano_train
