collection,title,abstract,journal,year,paper_id,domain,group
PubMed,Determination of rate constants and half-lives for the simultaneous biodegradation of several cyanobacterial metabolites in Australian source waters.,"The fate of five cyanobacterial metabolites was assessed in water sourced from Lake Burragorang (Warragamba Dam) in New South Wales, Australia. All of the studied metabolites were shown to be biodegradable in this water source. For some metabolites, biodegradation was influenced by factors, including temperature, location (within the water body) and seasonal variations. The biodegradation of the metabolites was shown to follow pseudo-first-order kinetics with rate constants ranging from 8.0 × 10(-4) to 1.3 × 10(-2) h(-1). Half-lives of the metabolites were also estimated and ranged from 2.2 to 36.1 d. The order of ease of biodegradability in this water source followed the trend: microcystin-LR ≥ cylindrospermopsin > saxitoxins > geosmin ≥ 2-methylisoborneol. The lack of detection of the mlrA gene during microcystin biodegradation suggests that these toxins may be degraded via a different pathway. While no metabolite-degrading organisms were isolated in this study, the inoculation of previously isolated geosmin- and microcystin-degrading bacteria into Lake Burragorang water resulted in efficient biodegradation of the respective metabolites. For example, microcystin-degrading isolate TT25 was able to degrade three microcystin variants to concentrations below analytical detection within 24 h, suggesting that inoculation of such bacteria has the potential to enhance biodegradation in Lake Burragorang.",,2012,22921397,cyanobacteria,cyano_train
PubMed,Evolution of saxitoxin synthesis in cyanobacteria and dinoflagellates.,"Dinoflagellates produce a variety of toxic secondary metabolites that have a significant impact on marine ecosystems and fisheries. Saxitoxin (STX), the cause of paralytic shellfish poisoning, is produced by three marine dinoflagellate genera and is also made by some freshwater cyanobacteria. Genes involved in STX synthesis have been identified in cyanobacteria but are yet to be reported in the massive genomes of dinoflagellates. We have assembled comprehensive transcriptome data sets for several STX-producing dinoflagellates and a related non-toxic species and have identified 265 putative homologs of 13 cyanobacterial STX synthesis genes, including all of the genes directly involved in toxin synthesis. Putative homologs of four proteins group closely in phylogenies with cyanobacteria and are likely the functional homologs of sxtA, sxtG, and sxtB in dinoflagellates. However, the phylogenies do not support the transfer of these genes directly between toxic cyanobacteria and dinoflagellates. SxtA is split into two proteins in the dinoflagellates corresponding to the N-terminal portion containing the methyltransferase and acyl carrier protein domains and a C-terminal portion with the aminotransferase domain. Homologs of sxtB and N-terminal sxtA are present in non-toxic strains, suggesting their functions may not be limited to saxitoxin production. Only homologs of the C-terminus of sxtA and sxtG were found exclusively in toxic strains. A more thorough survey of STX+ dinoflagellates will be needed to determine if these two genes may be specific to SXT production in dinoflagellates. The A. tamarense transcriptome does not contain homologs for the remaining STX genes. Nevertheless, we identified candidate genes with similar predicted biochemical activities that account for the missing functions. These results suggest that the STX synthesis pathway was likely assembled independently in the distantly related cyanobacteria and dinoflagellates, although using some evolutionarily related proteins. The biological role of STX is not well understood in either cyanobacteria or dinoflagellates. However, STX production in these two ecologically distinct groups of organisms suggests that this toxin confers a benefit to producers that we do not yet fully understand.",,2013,22628533,cyanobacteria,cyano_train
PubMed,First report of (homo)anatoxin-a and dog neurotoxicosis after ingestion of benthic cyanobacteria in The Netherlands.,"In April and May 2011, three dogs died and one dog became ill after swimming in Lake IJmeer (The Netherlands). At the time, the lake was infested with the benthic cyanobacterial species Phormidium. A Eurasian Coot (Fulica atra) and a Black-headed Gull (Chroicocephalus ridibundus) also died near Lake IJmeer in the same period. One of the dogs and both birds were subjected to a pathological investigation. Furthermore, the Phormidium mat; algal samples from the dikes; contents of the animals' digestive systems and organ tissues were analysed for the following cyanobacterial toxins: (homo)anatoxin-a; (7-deoxy-)cylindrospermopsin; saxitoxins and gonyautoxins by LC-MS/MS. Samples were also analysed for the nontoxic (homo)anatoxin-a metabolites dihydro(homo)anatoxin-a and epoxy(homo)anatoxin-a. The dog necropsy results indicated neurotoxicosis and its stomach contained Phormidium filaments. Anatoxin-a was detected in the Phormidium mat (272 μg g⁻¹) dry weight, stdev 65, n=3) and in the dog's stomach contents (9.5 μg g⁻¹ dry weight, stdev 2.4, n=3). Both samples also contained the anatoxin-a metabolite dihydroanatoxin-a, and a trace of homoanatoxin-a was detected in the Phormidium mat. The birds were in bad nutritive condition at the time of necropsy and their stomachs and intestines did not contain any cyanobacterial material. Furthermore, no cyanobacterial toxins were detected in their stomachs, intestines and organs and they both had lesions that are not associated with cyanobacterial intoxication. This is the first report of anatoxin-a and homoanatoxin-a occurrence in The Netherlands, these toxins have likely caused the deaths of three dogs. The birds probably died of other causes. Dutch recreational waters are at this moment only screened for pelagic cyanobacterial species, the current bathing water protocol therefore does not protect humans and animals from negative effects of blooms of benthic cyanobacteria.",,2012,22534073,cyanobacteria,cyano_train
PubMed,MOLECULAR CHARACTERIZATION OF THE DIVERSITY AND POTENTIAL TOXICITY OF CYANOBACTERIAL MATS IN TWO TROPICAL LAGOONS IN THE SOUTH PACIFIC OCEAN(1).,"Marine benthic cyanobacteria in tropical areas have recently been associated with several human poisoning events. To enhance the characterization of these microorganisms and their potential toxicity, benthic cyanobacterial communities were sampled in the lagoons of two islands (Raivavae and Rurutu) located in French Polynesia where human poisoning events by seafood had been reported. The morphological appearance of the mats was used to identify four types of cyanobacterial mat. By a 16S rRNA sequencing approach, it appeared that these mats were usually dominated by a restricted number of operational taxonomic units (OTUs), which were closely related to Leptolyngbya, Oscillatoria, Hydrocoleum, and Anabaena sequences, as previously reported in other tropical lagoons. Interestingly, we determined that these dominant filamentous OTUs were associated in the mats with other cyanobacteria, including unicellular species. By using a population genetic approach based on the sequencing of the internally transcribed spacer (ITS) of the rRNA operon, we found a very restricted genetic diversity in the most common OTU, which displayed a high sequence similarity with Leptolyngbya sp. In addition, there was no geographic differentiation at various spatial scales in the distribution of the different genotypes, suggesting that this species is able to spread over large distances. Finally, PCR screening of genes involved in the biosynthesis of known cyanotoxins revealed the presence of the saxitoxin gene (stxG) in two mats containing a mix of filamentous and unicellular cyanobacterial species.",,2012,27009717,cyanobacteria,cyano_train
PubMed,Fate of cyanobacteria and their metabolites during water treatment sludge management processes.,"Cyanobacteria and their metabolites are an issue for water authorities; however, little is known as to the fate of coagulated cyanobacterial-laden sludge during waste management processes in water treatment plants (WTPs). This paper provides information on the cell integrity of Anabaena circinalis and Cylindrospermopsis raciborskii during: laboratory-scale coagulation/sedimentation processes; direct filtration and backwashing procedures; and cyanobacterial-laden sludge management practices. In addition, the metabolites produced by A. circinalis (geosmin and saxitoxins) and C. raciborskii (cylindrospermopsin) were investigated with respect to their release (and possible degradation) during each of the studied processes. Where sedimentation was used, coagulation effectively removed cyanobacteria (and intracellular metabolites) without any considerable exertion on coagulant demand. During direct filtration experiments, cyanobacteria released intracellular metabolites through a stagnation period, suggesting that more frequent backwashing of filters may be required to prevent floc build-up and metabolite release. Cyanobacteria appeared to be protected within the flocs, with minimal damage during backwashing of the filters. Within coagulant sludge, cyanobacteria released intracellular metabolites into the supernatant after 3d, even though cells remained viable up to 7d. This work has improved the understanding of cyanobacterial metabolite risks associated with management of backwash water and sludge and is likely to facilitate improvements at WTPs, including increased monitoring and the application of treatment strategies and operational practices, with respect to cyanobacterial-laden sludge and/or supernatant recycle management.",,2012,22444068,cyanobacteria,cyano_train
PubMed,Removal of cyanobacterial metabolites through wastewater treatment plant filters.,"Wastewaters have the potential to proliferate excessive numbers of cyanobacteria due to high nutrient levels. This could translate to the production of metabolites, such as the saxitoxins, geosmin and 2-methylisoborneol (MIB), which can impair the quality of wastewater destined for re-use. Biological sand filtration was assessed for its ability to remove these metabolites from a wastewater. Results indicated that the sand filter was incapable of effectively removing the saxitoxins and in some instances, the effluent of the sand filter displayed greater toxicity than the influent. Conversely, the sand filter was able to effectively remove geosmin and MIB, with removal attributed to biodegradation. Granular activated carbon was employed as an alternative filter medium to remove the saxitoxins. Results showed similar removals to previous drinking water studies, where efficient removals were initially observed, followed by a decrease in the removal; a consequence of the presence of competing organics which reduced adsorption of the saxitoxins.",,2012,22437022,cyanobacteria,cyano_train
PubMed,Environmental conditions that influence toxin biosynthesis in cyanobacteria.,"Over the past 15 years, the genetic basis for production of many cyanobacterial bioactive compounds has been described. This knowledge has enabled investigations into the environmental factors that regulate the production of these toxins at the molecular level. Such molecular or systems level studies are also likely to reveal the physiological role of the toxin and contribute to effective water resource management. This review focuses on the environmental regulation of some of the most relevant cyanotoxins, namely the microcystins, nodularin, cylindrospermopsin, saxitoxins, anatoxins and jamaicamides.",,2013,22429476,cyanobacteria,cyano_train
PubMed,Biodegradation of multiple cyanobacterial metabolites in drinking water supplies.,"The fate of multiple cyanobacterial metabolites was assessed in two Australian source waters. The saxitoxins were the only metabolites shown to be non-biodegradable in Myponga Reservoir water, while microcystin-LR (MCLR) and geosmin were biodegradable in this water source. Likewise, cylindrospermopsin (CYN) was shown to be biodegradable in River Murray water. The order of ease of biodegradability followed the trend: MCLR>CYN>geosmin>saxitoxins. Biodegradation of the metabolites was affected by temperature and seasonal variations with more rapid degradation at 24°C and during autumn compared with 14°C and during winter. A microcystin-degrading bacterium was isolated and shown to degrade four microcystin variants within 4 h. This bacterium, designated as TT25, was shown to be 99% similar to a Sphingopyxis sp. based on a 16S rRNA gene fragment. Isolate TT25 was shown to contain a homologue of the mlrA gene; the sequence of which was 99% similar to that of a previously reported microcystin-degrader. Furthermore, isolate TT25 could degrade the microcystins in the presence of copper sulphate (0.5 mg L(-1) as Cu(2+)) which is advantageous for water authorities dosing such algicides into water bodies to control cyanobacterial blooms.",,2012,22386459,cyanobacteria,cyano_train
PubMed,Inhibition of copper uptake in yeast reveals the copper transporter Ctr1p as a potential molecular target of saxitoxin.,"Saxitoxin is a secondary metabolite produced by several species of dinoflagellates and cyanobacteria which targets voltage-gated sodium and potassium channels in higher vertebrates. However, its molecular target in planktonic aquatic community members that co-occur with the toxin producers remains unknown. Previous microarray analysis with yeast identified copper and iron-homeostasis genes as being differentially regulated in response to saxitoxin. This study sought to identify the molecular target in microbial cells by comparing the transcriptional profiles of key copper and iron homeostasis genes (CTR1, FRE1, FET3, CUP1, CRS5) in cells exposed to saxitoxin, excess copper, excess iron, an extracellular Cu(I) chelator, or an intracellular Cu(I) chelator. Protein expression and localization of Ctr1p (copper transporter), Fet3p (multicopper oxidase involved in high-affinity iron uptake), and Aft1p (iron regulator) were also compared among treatments. Combined transcript and protein profiles suggested saxitoxin inhibited copper uptake. This hypothesis was confirmed by intracellular Cu(I) imaging with a selective fluorescent probe for labile copper. On the basis of the combined molecular and physiological results, a model is presented in which the copper transporter Ctr1p serves as a molecular target of saxitoxin and these observations are couched in the context of the eco-evolutionary role this toxin may serve for species that produce it.",,2012,22304436,cyanobacteria,cyano_train
PubMed,Monitoring of shrimp and farmed fish sold in Canada for cyanobacterial toxins.,"Sixty-one samples of shrimp and 32 samples of farmed fish collected from retail markets across Canada were analyzed for cyanobacterial toxins, including microcystins, paralytic shellfish poisons (saxitoxins), cylindrospermopsin, and β-N-methylamino-L-alanine, using established methods of analysis. None of these toxins were detected in any of the samples. Some shrimp samples screened for paralytic shellfish poisons showed the presence of unknown peaks in the chromatogram after periodate oxidation.",,2012,22221371,cyanobacteria,cyano_train
PubMed,Detection and confirmation of saxitoxin analogues in freshwater benthic Lyngbya wollei algae collected in the St. Lawrence River (Canada) by liquid chromatography-tandem mass spectrometry.,"The presence of cyanotoxins in benthic Lyngbya wollei algae samples collected in a fluvial lake along the St. Lawrence River, Canada, was investigated using a multi-toxins method. Hydrophilic interaction liquid chromatography (HILIC) and reverse phased liquid chromatography (RPLC) were coupled to triple quadrupole mass spectrometry (LC-QqQMS) for quantification and to quadrupole-time of flight mass spectrometry (LC-QqTOFMS) for screening and confirmation. The presence of two saxitoxin analogues, LWTX-1 and LWTX-6, was confirmed in benthic Lyngbya wollei algae samples. Concentration of LWTX-1 was between 209±5 and 279±9 μg g(-1). No other targeted cyanotoxin (such as anatoxin-a, nodularin, microcystin-LR, microcystins-RR and saxitoxin) was found in the samples. The presence of LWTX-6 was observed by using a screening approach based on an in-house database of cyanotoxins, an algorithm of identification and high resolution mass spectrometry measurements on the precursor and product ions. This work demonstrates the need for more research on the fate of benthic cyanotoxins in aquatic ecosystems such the St. Lawrence River.",,2012,22169195,cyanobacteria,cyano_train
PubMed,Verification and quantification of saxitoxin from algal samples using fast and validated hydrophilic interaction liquid chromatography-tandem mass spectrometry method.,"Hydrophilic interaction liquid chromatography-tandem mass spectrometry (HILIC-MS/MS) method was validated with algal samples for verification and quantification of saxitoxin (STX), a potent neurotoxin which is listed in the Chemical Weapons Convention (CWC) in Schedule 1A. Isocratic elution, conventional bore HILIC column and high flow rate together with accurate post-column splitter provided detection of STX in 6.5 min with total analysis time of 9 min per sample. STX analogue, gonyautoxin 1 (GTX 1) was used as an internal standard. Sample preparation of freeze-dried algae included liquid extraction and centrifugal filtering with mean recovery of 99.9% at concentration level of 10 ng/ml (n=3). Retention times for STX and GTX 1 were 6.47±0.03 min and 4.44±0.01 min (n=45), respectively. Four diagnostic product ions were used for reliable verification of saxitoxin. Method was found to be precise and linear (R(2)=0.9714 and R(2)=0.9768) in concentration ranges of 5-50 ng/ml and 25-200 ng/ml, respectively. For saxitoxin, calculated LOD was 3 ng/ml and LLOQ 11 ng/ml. Validation was conducted using spiked algal matrix since this method is not only needed for verification analysis for the CWC but also for safety analysis of other environmental samples for presence of STX. Identification criteria for verification of STX with HILIC-MS/MS method are discussed.",,2012,22137456,cyanobacteria,cyano_train
PubMed,Biological treatment options for cyanobacteria metabolite removal--a review.,"The treatment of cyanobacterial metabolites can consume many resources for water authorities which can be problematic especially with the recent shift away from chemical- and energy-intensive processes towards carbon and climate neutrality. In recent times, there has been a renaissance in biological treatment, in particular, biological filtration processes, for cyanobacteria metabolite removal. This in part, is due to the advances in molecular microbiology which has assisted in further understanding the biodegradation processes of specific cyanobacteria metabolites. However, there is currently no concise portfolio which captures all the pertinent information for the biological treatment of a range of cyanobacterial metabolites. This review encapsulates all the relevant information to date in one document and provides insights into how biological treatment options can be implemented in treatment plants for optimum cyanobacterial metabolite removal.",,2012,22133838,cyanobacteria,cyano_train
PubMed,"Community composition, toxigenicity, and environmental conditions during a cyanobacterial bloom occurring along 1,100 kilometers of the Murray River.","A cyanobacterial bloom impacted over 1,100 km of the Murray River, Australia, and its tributaries in 2009. Physicochemical conditions in the river were optimal to support a bloom at the time. The data suggest that at least three blooms occurred concurrently in different sections of the river, with each having a different community composition and associated cyanotoxin profile. Microscopic and genetic analyses suggested the presence of potentially toxic Anabaena circinalis, Microcystis flos-aquae, and Cylindrospermopsis raciborskii at many locations. Low concentrations of saxitoxins and cylindrospermopsin were detected in Anabaena and Cylindrospermopsis populations. A multiplex quantitative PCR was used, employing novel oligonucleotide primers and fluorescent TaqMan probes, to examine bloom toxigenicity. This single reaction method identified the presence of the major cyanotoxin-producing species present in these environmental samples and also quantified the various toxin biosynthesis genes. A large number of cells present throughout the bloom were not potential toxin producers or were present in numbers below the limit of detection of the assay and therefore not an immediate health risk. Potential toxin-producing cells, possessing the cylindrospermopsin biosynthesis gene (cyrA), predominated early in the bloom, while those possessing the saxitoxin biosynthesis gene (sxtA) were more common toward its decline. In this study, the concentrations of cyanotoxins measured via enzyme-linked immunosorbent assay (ELISA) correlated positively with the respective toxin gene copy numbers, indicating that the molecular method may be used as a proxy for bloom risk assessment.",,2012,22081581,cyanobacteria,cyano_train
PubMed,Na+-stimulated phosphate uptake system in Synechocystis sp. PCC 6803 with Pst1 as a main transporter.,"Most living cells uptake phosphate, an indispensable nutrient for growth from their natural environment. In Synechocystis sp. PCC 6803, the cells lack phosphate-inorganic transport (Pit) system but contain two phosphate-specific transport (Pst) systems, Pst1 and Pst2. We investigated the kinetics of Pi uptake of these two Pst systems by constructing the two mutants, ΔPst1 and ΔPst2, and comparing their kinetic properties with those of the wild-type cells under both Pi-sufficient and deficient conditions. The effects of pH and Na+ on the uptake of phosphate in Synechocystis were also studied. Growth rates of the two mutants and wild type were similar either under phosphate-sufficient or deficient condition. The Km for phosphate uptake was 6.09 μM in wild type and this was reduced to 0.13 μM in ΔPst1 cells and 5.16 μM in the ΔPst2 strain. The Vmax values of 2.48, 0.22, and 2.17 μmol • (min • mg of chlorophyll a)-1 were obtained for wild type, the ΔPst1 and ΔPst2 strains, respectively. A monophasic phosphate uptake was observed in wild-type cells. The uptake of phosphate was energy and pH-dependent with a broad pH optimum between pH 7-10. Osmolality imposed by NaCl stimulated phosphate uptake whereas that imposed by sorbitol decreased uptake, suggesting stimulation of uptake was dependent upon ionic effects. The data demonstrate that Pst2 system of Synechocystis has higher affinity toward phosphate with lower Vmax than Pst1 system. The Pst1 system had similar Km and Vmax values to those of the wild type suggesting that Pst1 is the main phosphate transporter in Synechocystis sp. PCC 6803. The Km of Pst1 of Synechocystis is closer to that of Pit system than to that of the Pst system of E. coli, suggesting that Synechocystis Pst1 is rather a medium/low affinity transporter whereas Pst2 is a high affinity transporter.",,2011,21985090,cyanobacteria,cyano_train
PubMed,Novel cytotoxicity associated with Anabaena circinalis 131C.,"The production of secondary metabolites by cyanobacteria is extensively varied. Anabaena spp. have been shown to produce the toxins saxitoxin, anatoxin-a, anatoxin-a(s), cylindrospermopsin and microcystin. In this study we show cytotoxicity associated with Anabaena circinalis 131C that could not be attributed to its high saxitoxin content. Analytical, ELISA and enzymatic methods excluded the presence of other known cyanobacterial toxins leading to the suggestion of novel toxicity.",,2011,21964631,cyanobacteria,cyano_train
PubMed,The inhibitory effect of calcium on Cylindrospermopsis raciborskii (cyanobacteria) metabolism.,"Cylindrospermopsis raciborskii (Woloszynska) Seenaya & Subba Raju is a freshwater cyanobacterium of worldwide distribution. In the North-eastern region of Brazil many eutrophic water reservoirs are characterized by the dominance of C. raciborskii, with recurrent occurrence of blooms. These water bodies have high conductivity due to a high ionic concentration, and are defined as hard (with high values of CaCO3). In this study, we investigated the long-term effect (12 days) of high calcium concentration (8 mM Ca(2+)) on C. raciborskii (T3 strain) growth, morphology, toxin content, and metabolism. Changes in protein expression profiles were investigated by proteomic analysis using 2D gel electrophoresis and mass spectrometry. A continued exposure to calcium had a pronounced effect on C. raciborskii (T3): it limited growth, decreased thricome length, increased chlorophyll-a content, altered toxin profile (although did not affect PST content, saxitoxin + neosaxitoxin), and inhibited the expression of proteins related to primary metabolism.",,2011,24031789,cyanobacteria,cyano_train
