collection,title,abstract,journal,year,paper_id,domain,group
PubMed,Chronic exposure to sublethal concentrations of saxitoxin reduces antioxidant activity and immunity in zebrafish but does not affect reproductive parameters.,"Saxitoxin produced by dinoflagellates and cyanobacteria can be transferred to humans through intoxicated organisms such as fish, but limited research has addressed the adverse effects of this toxin on aquatic organisms. In this study, we measured the potential effects of a 90-day exposure to saxitoxin (0.1 or 1 µg·L - 1 ) on body weight and length, antioxidant defense system, immunity, sex hormones, and genes involved in associated key metabolic pathways in zebrafish (Danio rerio). Significant impairments in body weight and length were observed in response to 1 µg·L - 1 saxitoxin in both male and female zebrafish. A significant increase in the levels of malondialdehyde, together with decreased enzymatic activities of catalase and superoxide dismutase, was observed in fish of both sexes exposed to 1 µg·L - 1 saxitoxin, indicating the occurrence of lipid peroxidation and oxidative stress. Immune parameters such as alternative complement activity, lysozyme activity, and immunoglobulin content were also significantly reduced. However, exposure of male and female zebrafish to saxitoxin for 90 days did not significantly affect reproductive parameters such as the gonadosomatic index and plasma concentrations of vitellogenin, estradiol, and 11-keto testosterone. Transcriptional responses showed similar trends to those of the biochemical parameters, as genes involved in the antioxidant defense system and immunity were downregulated, whereas the transcription of genes related to reproductive metabolism showed no significant change upon treatment with 1 µg·L - 1 saxitoxin. Our findings indicate that long-term exposure to a sublethal concentration of saxitoxin can inhibit growth through induction of oxidative stress and immunosuppression, while the reproductive parameters of zebrafish are not a main target of this toxin at sublethal concentrations.",,2022,34974311,cyanobacteria,cyano_train
PubMed,The Common Sunstar Crossaster papposus -A Neurotoxic Starfish.,"Saxitoxins (STXs) are a family of potent neurotoxins produced naturally by certain species of phytoplankton and cyanobacteria which are extremely toxic to mammalian nervous systems. The accumulation of STXs in bivalve molluscs can significantly impact animal and human health. Recent work conducted in the North Sea highlighted the widespread presence of various saxitoxins in a range of benthic organisms, with the common sunstar ( Crossaster papposus ) demonstrating high concentrations of saxitoxins. In this study, an extensive sampling program was undertaken across multiple seas surrounding the UK, with 146 starfish and 5 brittlestars of multiple species analysed for STXs. All the common sunstars analysed ( n > 70) contained quantifiable levels of STXs, with the total concentrations ranging from 99 to 11,245 µg STX eq/kg. The common sunstars were statistically different in terms of toxin loading to all the other starfish species tested. Two distinct toxic profiles were observed in sunstars, a decarbomylsaxitoxin (dcSTX)-dominant profile which encompassed samples from most of the UK coast and an STX and gonyautoxin2 (GTX2) profile from the North Yorkshire coast of England. Compartmentalisation studies demonstrated that the female gonads exhibited the highest toxin concentrations of all the individual organs tested, with concentrations >40,000 µg STX eq/kg in one sample. All the sunstars, male or female, exhibited the presence of STXs in the skin, digestive glands and gonads. This study highlights that the common sunstar ubiquitously contains STXs, independent of the geographical location around the UK and often at concentrations many times higher than the current regulatory limits for STXs in molluscs; therefore, the common sunstar should be considered toxic hereafter.",,2021,34940694,cyanobacteria,cyano_train
PubMed,"Co-occurrence of multiple cyanotoxins and taste-and-odor compounds in the large eutrophic Lake Taihu, China: Dynamics, driving factors, and challenges for risk assessment.","Cyanobacterial blooms producing toxic metabolites occur frequently in freshwater, yet the environmental behaviors of complex cyanobacterial metabolites remain largely unknown. In this study, the seasonal and spatial variations of several classes of cyanotoxins (microcystins, cylindrospermopsins, saxitoxins) and taste-and-odor (T&O) compounds (β-cyclocitral, β-ionone, geosmin, 2-methylisoborneol) in Lake Taihu were simultaneously investigated for the first time. The total cyanotoxins were dominated by microcystins with concentrations highest in November (mean 2209 ng/L) and lowest in February (mean 48.7 ng/L). Cylindrospermopsins were abundant in May with the highest content of 622.8 ng/L. Saxitoxins only occurred in May (mean 19.2 ng/L) and November (mean 198.5 ng/L). Extracellular T&O compounds were most concentrated in August, the highest being extracellular β-cyclocitral (mean 240.6 ng/L) followed by 2-methylisoborneol (mean 146.6 ng/L). Environment variables play conflicting roles in modulating the dynamics of different groups of cyanotoxins and T&O compounds. Total phosphorus (TP), total nitrogen (TN), chlorophyll-a and cyanobacteria density were important factors affecting the variation of total microcystins, β-cyclocitral and β-ionone concentrations. In contrast, total cylindrospermopsins, 2-methylisoborneol and geosmin concentrations were significantly influenced by water temperature and TP. There was a significant and linear relationship between microcystins and β-cyclocitral/β-ionone, while cylindrospermopsins were positively correlated with 2-methylisoborneol and geosmin. The perceptible odors may be good indicators for the existence of cyanotoxins. Hazard quotients revealed that potential human health risks from microcystins were high in August and November. Meanwhile, the risks from cylindrospermopsins were at moderate levels. Cylindrospermopsins and saxitoxins were first identified in this lake, suggesting that diverse cyanotoxins might co-occur more commonly than previously thought. Hence, the risks from other cyanotoxins beyond microcystins shouldn't be ignored. This study also highlights that the necessity for further assessing the combination effects of these complex metabolites.",,2022,34848287,cyanobacteria,cyano_train
PubMed,Metagenomic analysis of Raphidiopsisraciborskii microbiome: beyond the individual.,"Raphidiopsisraciborskii is a toxic, invasive bacteria with a defined biogeographic pattern attributed to the generation of ecotypes subjected to local environmental filters and to phenotypic plasticity. The interactions taking place between the cyanobacterium and the other bacteria inhabiting the external polysaccharide-rich matrix surrounding the cells, or phycosphere, may be ecotype-specific and would have different influence on the carbon and nutrient cycling in the ecosystem. Here, we describe the bacterial community or microbiome (assessed by 16S rRNA metagenomics) associated to two R.raciborskii strains that have been described as different ecotypes: the saxitoxin-producer MVCC19 and the non-toxic LB2897. Our results showed that both ecotypes share 50% of their microbiomes and differ in their dominant taxa. The taxon having the highest abundance in the microbiome of MVCC19 was Neorhizobium (22.5% relative abundance), while the dominant taxon in LB2897 was the Planctomycetes SM1A02 (26.2% relative abundance). These groups exhibit different metabolic capabilities regarding nitrogen acquisition (symbiotic nitrogen-fixing in Neorhizobium vs. anammox in SM1A02 ), suggesting the existence of ecotype-specific microbiomes that play a relevant role in cyanobacterial niche-adaptation. In addition, as saxitoxin and analogues are nitrogen-rich (7 atoms per molecule), we hypothesise that saxitoxin-producing R.raciborskii benefits from external sources of nitrogen provided by the microbiome bacteria. Based on these findings, we propose that the mechanisms involved in the assembly of the cyanobacterial microbiome community are ecotype-dependent.",,2021,34754266,cyanobacteria,cyano_train
PubMed,"Permanent occurrence of Raphidiopsis raciborskii and cyanotoxins in a subtropical reservoir polluted by domestic effluents (Itupararanga reservoir, São Paulo, Brazil).","Toxic cyanobacteria blooms are a frequent problem in subtropical reservoirs and freshwater systems. The purpose of this study was to investigate the occurrence of potentially toxic cyanobacteria and the environmental conditions associated with the presence of cyanotoxins in a Brazilian subtropical reservoir. Five collections were carried out at seven sampling locations in the reservoir, during the rainy and dry seasons, between the years 2016 and 2017. There was permanent occurrence of Raphidiopsis raciborskii (Woloszynska) Aguilera, Berrendero Gómez, Kastovsky, Echenique & Salerno (Phycologia 57(2):130-146, 2018), ranging between dominant and abundant, with an average biomass of 38.8 ± 29.9 mg L -1 . Also abundant were Dolichospermum solitarium, D. planctonicum, Planktothrix isothrix, and Aphanizomenon gracile. Saxitoxin (STX) was detected in all the collected samples (0.11 ± 0.05 µg L -1 ). Microcystin (MC) was also detected, but at lower concentrations (0.01 ± 0.0 µg L -1 ). Low availability of NO 3 - and phosphorus limitation had significant effects on the R. raciborskii biomass and the levels of STX and MC. It was observed that R. raciborskii was sensitive to thermal stratification, at the same time that STX levels were higher. This suggested that STX was produced under conditions that restricted the growth of R. raciborskii. These are important findings, because they add information about the permanent occurrence of STX and R. raciborskii in an aquatic ecosystem limited by phosphorus, vulnerable to climatic variations, and polluted by domestic effluents.",,2022,34697712,cyanobacteria,cyano_train
PubMed,In Vivo and In Vitro Toxicity Testing of Cyanobacterial Toxins: A Mini-Review.,"Harmful cyanobacterial blooms are increasing and becoming a worldwide concern as many bloom-forming cyanobacterial species can produce toxic metabolites named cyanotoxins. These include microcystins, saxitoxins, anatoxins, nodularins, and cylindrospermopsins, which can adversely affect humans, animals, and the environment. Different methods to assess these classes of compounds in vitro and in vivo include biological, biochemical, molecular, and physicochemical techniques. Furthermore, toxic effects not attributable to known cyanotoxins can be observed when assessing bloom material. In order to determine exposures to cyanotoxins and to monitor compliance with drinking and bathing water guidelines, it is necessary to have reliable and effective methods for the analysis of these compounds. Many relatively simple low-cost methods can be employed to rapidly evaluate the potential hazard. The main objective of this mini-review is to describe the assessment of toxic cyanobacterial samples using in vitro and in vivo bioassays. Newly emerging cyanotoxins, the toxicity of analogs, or the interaction of cyanobacteria and cyanotoxins with other toxicants, among others, still requires bioassay assessment. This review focuses on some biological and biochemical assays (MTT assay, Immunohistochemistry, Micronucleus Assay, Artemia salina assay, Daphnia magna test, Radionuclide recovery, Neutral red cytotoxicity and Comet assay, Enzyme-Linked Immunosorbent Assay (ELISA), Annexin V-FITC assay and Protein Phosphatase Inhibition Assay (PPIA)) for the detection and measurement of cyanotoxins including microcystins, cylindrospermopsins, anatoxin-a, saxitoxins, and nodularins. Although most bioassay analyses often confirm the presence of cyanotoxins at low concentrations, such bioassays can be used to determine whether some strains or blooms of cyanobacteria may produce other, as yet unknown toxic metabolites. This review also aims to identify research needs and data gaps concerning the toxicity assessment of cyanobacteria.",,2021,34622370,cyanobacteria,cyano_train
PubMed,"Microcystis Sp. Co-Producing Microcystin and Saxitoxin from Songkhla Lake Basin, Thailand.","The Songkhla Lake Basin (SLB) located in Southern Thailand, has been increasingly polluted by urban and industrial wastewater, while the lake water has been intensively used. Here, we aimed to investigate cyanobacteria and cyanotoxins in the SLB. Ten cyanobacteria isolates were identified as Microcystis genus based on16S rDNA analysis. All isolates harbored microcystin genes, while five of them carried saxitoxin genes. On day 15 of culturing, the specific growth rate and Chl-a content were 0.2-0.3 per day and 4 µg/mL. The total extracellular polymeric substances (EPS) content was 0.37-0.49 µg/mL. The concentration of soluble EPS (sEPS) was 2 times higher than that of bound EPS (bEPS). The protein proportion in both sEPS and bEPS was higher than the carbohydrate proportion. The average of intracellular microcystins (IMCs) was 0.47 pg/cell on day 15 of culturing, while extracellular microcystins (EMCs) were undetectable. The IMCs were dramatically produced at the exponential phase, followed by EMCs release at the late exponential phase. On day 30, the total microcystins (MCs) production reached 2.67 pg/cell. Based on liquid chromatograph-quadrupole time-of-flight mass spectrometry, three new MCs variants were proposed. This study is the first report of both decarbamoylsaxitoxin (dcSTX) and new MCs congeners synthesized by Microcystis .",,2021,34564635,cyanobacteria,cyano_train
PubMed,Electrochemical Biosensors for Tracing Cyanotoxins in Food and Environmental Matrices.,"The adoption of electrochemical principles to realize on-field analytical tools for detecting pollutants represents a great possibility for food safety and environmental applications. With respect to the existing transduction mechanisms, i.e., colorimetric, fluorescence, piezoelectric etc., electrochemical mechanisms offer the tremendous advantage of being easily miniaturized, connected with low cost (commercially available) readers and unaffected by the color/turbidity of real matrices. In particular, their versatility represents a powerful approach for detecting traces of emerging pollutants such as cyanotoxins. The combination of electrochemical platforms with nanomaterials, synthetic receptors and microfabrication makes electroanalysis a strong starting point towards decentralized monitoring of toxins in diverse matrices. This review gives an overview of the electrochemical biosensors that have been developed to detect four common cyanotoxins, namely microcystin-LR, anatoxin-a, saxitoxin and cylindrospermopsin. The manuscript provides the readers a quick guide to understand the main electrochemical platforms that have been realized so far, and the presence of a comprehensive table provides a perspective at a glance.",,2021,34562905,cyanobacteria,cyano_train
PubMed,Antibacterial activity of γFe 2 O 3 /TiO 2 nanoparticles on toxic cyanobacteria from a lake in Southern Illinois.,"Frequent outbreaks of harmful algal blooms (HABs) have brought adverse impacts on human health, economic viability, and recreational activities in many communities in the United States. Cyanobacteria (or blue-green algae) blooms are the most common type of HABs in surface water. Current bactericides for controlling the blooms are disadvantageous due to the recycling difficulty. In this study, an innovative magnetic nanomaterial-γFe 2 O 3 /TiO 2 nanoparticle-was used to inactivate toxic cyanobacteria species found in a lake in Southern Illinois that frequently experienced HABs. Cyanotoxin genes of mcy, nda, cyr, and sxt were used for targeting microcystin-, nodularin-, cylindrospermopsin-, and saxitoxin-producing cyanobacteria, respectively, by quantitative polymerase chain reaction (PCR) method. It was found that the concentration of chlorophyll a presents a strong correlation (R 2 = 0.6024) with the gene copy obtained from 16S rRNA targeted for all cyanobacteria, but not with that from individual toxigenic cyanobacteria. The inactivation efficiencies of the nanomaterials under visible light were as high as 5-log and 1-log for cyanobacteria species containing mcyE/ndaF and sxtA genes, respectively, an improvement over the treatment under darkness. These nanomaterials can be recycled by their magnetic properties for reuse. Communities susceptible to HAB outbreaks are expected to benefit from the developed method for mitigating the blooms. PRACTITIONER POINTS: Lab-made γFe 2 O 3 /TiO 2 nanoparticles can be used to inactivate microcystin/nodularin- and saxitoxin-producing cyanobacteria species. qPCR method can be used for targeting toxic cyanobacteria; Chl a cannot be used as a standalone indicator for HABs. Better inactivation efficiency under visible light indicated possible application of the technology under sunlight for HAB mitigation from surface water.",,2021,34520086,cyanobacteria,cyano_train
PubMed,Reviewing Interspecies Interactions as a Driving Force Affecting the Community Structure in Lakes via Cyanotoxins.,"The escalating occurrence of toxic cyanobacterial blooms worldwide is a matter of concern. Global warming and eutrophication play a major role in the regularity of cyanobacterial blooms, which has noticeably shifted towards the predomination of toxic populations. Therefore, understanding the effects of cyanobacterial toxins in aquatic ecosystems and their advantages to the producers are of growing interest. In this paper, the current literature is critically reviewed to provide further insights into the ecological contribution of cyanotoxins in the variation of the lake community diversity and structure through interspecies interplay. The most commonly detected and studied cyanobacterial toxins, namely the microcystins, anatoxins, saxitoxins, cylindrospermopsins and β-N-methylamino-L-alanine, and their ecotoxicity on various trophic levels are discussed. This work addresses the environmental characterization of pure toxins, toxin-containing crude extracts and filtrates of single and mixed cultures in interspecies interactions by inducing different physiological and metabolic responses. More data on these interactions under natural conditions and laboratory-based studies using direct co-cultivation approaches will provide more substantial information on the consequences of cyanotoxins in the natural ecosystem. This review is beneficial for understanding cyanotoxin-mediated interspecies interactions, developing bloom mitigation technologies and robustly assessing the hazards posed by toxin-producing cyanobacteria to humans and other organisms.",,2021,34442662,cyanobacteria,cyano_train
PubMed,"Cyanobacteria, cyanotoxins, and their histopathological effects on fish tissues in Fehérvárcsurgó reservoir, Hungary.","Cyanobacteria are important members of lake plankton, but they have the ability to form blooms and produce cyanotoxins and thus cause a number of adverse effects. Freshwater ecosystems around the world have been investigated for the distribution of cyanobacteria and their toxins and the effects they have on the ecosystems. Similar research was performed on the Fehérvárcsurgó reservoir in Hungary during 2018. Cyanobacteria were present and blooming, and the highest abundance was recorded in July (2,822,000 cells/mL). The species present were Aphanizomenon flos-aquae, Microcystis flos-aquae, Microcystis wesenbergii, Cuspidothrix issatschenkoi, Dolichospermum flos-aquae, and Snowella litoralis. In July and September, the microcystin encoding gene mcyE and the saxitoxin encoding gene sxtG were amplified in the biomass samples. While a low concentration of microcystin-RR was found in one water sample from July, analyses of Abramis brama and Carassius gibelio caught from the reservoir did not show the presence of the investigated microcystins in the fish tissue. However, several histopathological changes, predominantly in gills and kidneys, were observed in the fish, and the damage was more severe during May and especially July, which coincides with the increase in cyanobacterial biomass during the summer months. Cyanobacteria may thus have adverse effects in this ecosystem.",,2021,34357469,cyanobacteria,cyano_train
PubMed,Synthesis of ecotoxicological studies on cyanotoxins in freshwater habitats - Evaluating the basis for developing thresholds protective of aquatic life in the United States.,"In recent decades, cyanobacteria harmful algal blooms (cyanoHABs) have increased in magnitude, frequency, and duration in freshwater ecosystems. CyanoHABs can impact water quality by the production of potent toxins known as cyanotoxins. Environmental exposure to cyanotoxins has been associated with severe illnesses in humans, domestic animals, and wildlife. However, the effects of sustained exposure to cyanotoxins on aquatic life are poorly understood. In this study, over 150 peer-reviewed articles were critically evaluated to better understand the ecotoxicity of 5 cyanotoxin classes (microcystins, cylindrospermopsin, anatoxin-a, saxitoxins, nodularin) on fish, amphibians, aquatic invertebrates, and birds exclusively feeding in freshwater habitats. The systemic review demonstrated that microcystins, and more specifically microcystin-LR, were the most studied cyanotoxins. Ecotoxicological investigations were typically conducted using a fish or aquatic invertebrate model, with mortality, bioaccumulation, and biochemical responses as the most frequently measured endpoints. After excluding the studies that did not meet our acceptability criteria, remaining studies were examined to identify the no-observed and lowest observed effect concentrations (NOEC and LOEC) for microcystins; the limited amount of data for other cyanotoxins did not allow for analysis. The published ecotoxicity data suggests that the U.S. EPA recreational water quality criteria for microcystin (8 μg/L) may be protective of acute toxicity in aquatic organisms but does not appear to protect against chronic toxicity. Individual U.S. states have developed more stringent recreational health-based thresholds, such as 0.8 μg/L in California. Comparisons of this threshold to the chronic NOEC and LOEC data indicate that more restrictive microcystins thresholds may be required to be protective of aquatic life. Additional research is needed to evaluate the sublethal effects of a wider array of microcystin congeners and other cyanotoxins on organisms relevant to U.S. watersheds to better support nationwide thresholds protective of aquatic life.",,2021,34328929,cyanobacteria,cyano_train
PubMed,Molecular detection of some toxogenic cyanobacteria in Tigris River in Baghdad-Iraq.,"Cyanobacteria and their pollution are being increasingly commonly reported worldwide that cause a serious hazard to environmental and human health. Cyanotoxin was the most algal toxin reported to be produced by several orders of cyanobacteria. This study aimed to provide a technique to detect cylindrosprmopsin and saxitoxin biosynthesis genes in the river. In November, December 2019, and January 2020. Cyanobacteria were isolated from freshwater of Tigris River and identified by compound microscope also conventional PCR. Five isolates of cyanobacteria that successfully amplified a gene fragment from the phycocyanin were found in all cyanobacteria (Microcystis flosaquae, Microcystis sp, anabaena circinalis, nostoc commune and westiellopsis prolifica) and all isolates successfully amplified aoaC gene to detecting the cylidrospemopsin and the saxitoxin. Our results concluded that PCR assay can be used for early detection of cylidrospemopsin and the saxitoxin producing cyanobacteria in river water that useful to stations responsible for the preparation of drinking water to public.",,2021,34283333,cyanobacteria,cyano_train
PubMed,Ecophysiological Aspects and sxt Genes Expression Underlying Induced Chemical Defense in STX-Producing Raphidiopsis raciborskii (Cyanobacteria) against the Zooplankter Daphnia gessneri .,"Cyanobacteria stand out among phytoplankton when they form massive blooms and produce toxins. Because cyanotoxin genes date to the origin of metazoans, the hypothesis that cyanotoxins function as a defense against herbivory is still debated. Although their primary cellular function might vary, these metabolites could have evolved as an anti-predator response. Here we evaluated the physiological and molecular responses of a saxitoxin-producing Raphidiopsis raciborskii to infochemicals released by the grazer Daphnia gessneri . Induced chemical defenses were evidenced in R. raciborskii as a significant increase in the transcription level of sxt genes, followed by an increase in saxitoxin content when exposed to predator cues. Moreover, cyanobacterial growth decreased, and no significant effects on photosynthesis or morphology were observed. Overall, the induced defense response was accompanied by a trade-off between toxin production and growth. These results shed light on the mechanisms underlying zooplankton-cyanobacteria interactions in aquatic food webs. The widespread occurrence of the cyanobacterium R. raciborskii in freshwater bodies has been attributed to its phenotypic plasticity. Assessing the potential of this species to thrive over interaction filters such as zooplankton grazing pressure can enhance our understanding of its adaptive success.",,2021,34200983,cyanobacteria,cyano_train
